Item Title,Publication Title,Book Series Title,Journal Volume,Journal Issue,Item DOI,Authors,Publication Year,URL,Content Type
"On the relation of control-flow and performance feature interactions: a case study","Empirical Software Engineering","","24","4","10.1007/s10664-019-09705-w","Sergiy KolesnikovNorbert SiegmundChristian KästnerSven Apel","2019","http://link.springer.com/article/10.1007/s10664-019-09705-w","Article"
"Quality characteristics and measures for human–computer interaction evaluation in ubiquitous systems","Software Quality Journal","","25","3","10.1007/s11219-016-9320-z","Rainara Maia CarvalhoRossana Maria de Castro AndradeKáthia Marçal de OliveiraIsmayle de Sousa SantosCarla Ilane Moreira Bezerra","2017","http://link.springer.com/article/10.1007/s11219-016-9320-z","Article"
"What it takes to boost Internet of Things privacy beyond encryption with unobservable communication: a survey and lessons learned from the first implementation of DC-net","Journal of Reliable Intelligent Environments","","5","1","10.1007/s40860-019-00075-0","Ralf C. StaudemeyerHenrich C. PöhlsMarcin Wójcik","2019","http://link.springer.com/article/10.1007/s40860-019-00075-0","Article"
"Program schemata technique for propositional program logics: A 30-year history","Programming and Computer Software","","42","4","10.1134/S036176881604006X","N. V. ShilovS. O. ShilovaA. Yu. Bernshtein","2016","http://link.springer.com/article/10.1134/S036176881604006X","Article"
"A partial oracle for uniformity statistics","Software Quality Journal","","27","4","10.1007/s11219-019-09459-0","Krishna PatelRobert M. Hierons","2019","http://link.springer.com/article/10.1007/s11219-019-09459-0","Article"
"Modeling Grounding for Interactive Social Companions","KI - Künstliche Intelligenz","","30","1","10.1007/s13218-015-0397-5","Gregor MehlmannKathrin JanowskiElisabeth André","2016","http://link.springer.com/article/10.1007/s13218-015-0397-5","Article"
"The Train Benchmark: cross-technology performance evaluation of continuous model queries","Software & Systems Modeling","","17","4","10.1007/s10270-016-0571-8","Gábor SzárnyasBenedek IzsóIstván RáthDániel Varró","2018","http://link.springer.com/article/10.1007/s10270-016-0571-8","Article"
"Home monitoring of motor fluctuations in Parkinson’s disease patients","Journal of Reliable Intelligent Environments","","5","3","10.1007/s40860-019-00086-x","Luigi BorzìMarilena VarrecchiaGabriella OlmoCarlo Alberto ArtusiMargherita FabbriMario Giorgio RizzoneAlberto RomagnoloMaurizio ZibettiLeonardo Lopiano","2019","http://link.springer.com/article/10.1007/s40860-019-00086-x","Article"
"Studying the consistency of star ratings and the complaints in 1 & 2-star user reviews for top free cross-platform Android and iOS apps","Empirical Software Engineering","","23","6","10.1007/s10664-018-9604-y","Hanyang HuCor-Paul BezemerAhmed E. Hassan","2018","http://link.springer.com/article/10.1007/s10664-018-9604-y","Article"
"Multi-core symbolic bisimulation minimisation","International Journal on Software Tools for Technology Transfer","","20","2","10.1007/s10009-017-0468-z","Tom van DijkJaco van de Pol","2018","http://link.springer.com/article/10.1007/s10009-017-0468-z","Article"
"Abstractive Text Summarization based on Improved Semantic Graph Approach","International Journal of Parallel Programming","","46","5","10.1007/s10766-018-0560-3","Atif KhanNaomie SalimHaleem FarmanMurad KhanBilal JanAwais AhmadImran AhmedAnand Paul","2018","http://link.springer.com/article/10.1007/s10766-018-0560-3","Article"
"A novel revenue optimization model to address the operation and maintenance cost of a data center","Journal of Cloud Computing","","5","1","10.1186/s13677-015-0050-8","Snehanshu SahaJyotirmoy SarkarAvantika DwivediNandita DwivediAnand M. NarasimhamurthyRanjan Roy","2016","http://link.springer.com/article/10.1186/s13677-015-0050-8","Article"
"Interacting with team oriented plans in multi-robot systems","Autonomous Agents and Multi-Agent Systems","","31","2","10.1007/s10458-016-9344-6","Alessandro FarinelliMasoume M. RaeissiNicolo’ MarchiNathan BrooksPaul Scerri","2017","http://link.springer.com/article/10.1007/s10458-016-9344-6","Article"
"High availability in clouds: systematic review and research challenges","Journal of Cloud Computing","","5","1","10.1186/s13677-016-0066-8","Patricia T. EndoMoisés RodriguesGlauco E. GonçalvesJudith KelnerDjamel H. SadokCalin Curescu","2016","http://link.springer.com/article/10.1186/s13677-016-0066-8","Article"
"General framework for testing using formal languages","International Journal of Information Technology","","9","1","10.1007/s41870-017-0007-x","S. LobatoJ. PoncelaM. Aamir","2017","http://link.springer.com/article/10.1007/s41870-017-0007-x","Article"
"BDI Logics for BDI Architectures: Old Problems, New Perspectives","KI - Künstliche Intelligenz","","31","1","10.1007/s13218-016-0457-5","Andreas HerzigEmiliano LoriniLaurent PerrusselZhanhao Xiao","2017","http://link.springer.com/article/10.1007/s13218-016-0457-5","Article"
"Parallelized and distributed task based ontology matching in clustering environment with semantic verification","CSI Transactions on ICT","","5","3","10.1007/s40012-017-0165-9","Tanni MittraMuhammad Masroor Ali","2017","http://link.springer.com/article/10.1007/s40012-017-0165-9","Article"
"Studying the consistency of star ratings and reviews of popular free hybrid Android and iOS apps","Empirical Software Engineering","","24","1","10.1007/s10664-018-9617-6","Hanyang HuShaowei WangCor-Paul BezemerAhmed E. Hassan","2019","http://link.springer.com/article/10.1007/s10664-018-9617-6","Article"
"Mining approximate interval-based temporal dependencies","Acta Informatica","","53","6 - 8","10.1007/s00236-015-0246-x","Carlo CombiPietro Sala","2016","http://link.springer.com/article/10.1007/s00236-015-0246-x","Article"
"Time-communication impossibility results for distributed transactional memory","Distributed Computing","","31","6","10.1007/s00446-017-0318-y","Costas BuschMaurice HerlihyMiroslav PopovicGokarna Sharma","2018","http://link.springer.com/article/10.1007/s00446-017-0318-y","Article"
"A Time Series Structure Analysis Method of a Meeting Using Text Data and a Visualization Method of State Transitions","New Generation Computing","","37","1","10.1007/s00354-018-0050-6","Ryotaro OkadaTakafumi NakanishiYuichi TanakaYutaka OgasawaraKazuhiro Ohashi","2019","http://link.springer.com/article/10.1007/s00354-018-0050-6","Article"
"One IoT: an IoT protocol and framework for OEMs to make IoT-enabled devices forward compatible","Journal of Reliable Intelligent Environments","","2","3","10.1007/s40860-016-0027-5","Gourinath BandaChaitanya Krishna BommakantiHarsh Mohan","2016","http://link.springer.com/article/10.1007/s40860-016-0027-5","Article"
"Comprehensibility of system models during test design: a controlled experiment comparing UML activity diagrams and state machines","Software Quality Journal","","27","1","10.1007/s11219-018-9407-9","Michael FeldererAndrea Herrmann","2019","http://link.springer.com/article/10.1007/s11219-018-9407-9","Article"
"LACross: Learning-Based Analytical Cross-Platform Performance and Power Prediction","International Journal of Parallel Programming","","45","6","10.1007/s10766-017-0487-0","Xinnian ZhengLizy K. JohnAndreas Gerstlauer","2017","http://link.springer.com/article/10.1007/s10766-017-0487-0","Article"
"Preventing duplicate bug reports by continuously querying bug reports","Empirical Software Engineering","","24","2","10.1007/s10664-018-9643-4","Abram HindleCurtis Onuczko","2019","http://link.springer.com/article/10.1007/s10664-018-9643-4","Article"
"Catalog of energy patterns for mobile applications","Empirical Software Engineering","","24","4","10.1007/s10664-019-09682-0","Luis CruzRui Abreu","2019","http://link.springer.com/article/10.1007/s10664-019-09682-0","Article"
"Breathing ontological knowledge into feature model synthesis: an empirical study","Empirical Software Engineering","","21","4","10.1007/s10664-014-9357-1","Guillaume BécanMathieu AcherBenoit BaudrySana Ben Nasr","2016","http://link.springer.com/article/10.1007/s10664-014-9357-1","Article"
"Construction of a model of a continuous light source specified by a fixed set of rays","Programming and Computer Software","","42","6","10.1134/S0361768816060074","D. D. ZhdanovA. A. AleinikovA. D. ZhdanovN. B. Deryabin","2016","http://link.springer.com/article/10.1134/S0361768816060074","Article"
"Publicly verifiable and efficiency/security-adjustable outsourcing scheme for solving large-scale modular system of linear equations","Journal of Cloud Computing","","8","1","10.1186/s13677-019-0145-8","Panpan MengChengliang TianXiangguo Cheng","2019","http://link.springer.com/article/10.1186/s13677-019-0145-8","Article"
"Implementing the template method pattern in genetic programming for improved time series prediction","Genetic Programming and Evolvable Machines","","19","1 - 2","10.1007/s10710-018-9320-9","David Moskowitz","2018","http://link.springer.com/article/10.1007/s10710-018-9320-9","Article"
"Classification of Anti-phishing Solutions","SN Computer Science","","1","1","10.1007/s42979-019-0011-2","S. ChantiT. Chithralekha","2019","http://link.springer.com/article/10.1007/s42979-019-0011-2","Article"
"Visualizing Collective Attention Using Association Networks","New Generation Computing","","34","4","10.1007/s00354-016-0402-z","Kazutoshi Sasahara","2016","http://link.springer.com/article/10.1007/s00354-016-0402-z","Article"
"Optimizing the Matrix Multiplication Using Strassen and Winograd Algorithms with Limited Recursions on Many-Core","International Journal of Parallel Programming","","44","4","10.1007/s10766-015-0378-1","Ayaz ul Hassan KhanMayez Al-MouhamedAllam FatayerNazeeruddin Mohammad","2016","http://link.springer.com/article/10.1007/s10766-015-0378-1","Article"
"Benchmarking Functionalities of Domestic Service Robots Through Scientific Competitions","KI - Künstliche Intelligenz","","33","4","10.1007/s13218-019-00619-9","Meysam BasiriEnrico PiazzaMatteo MatteucciPedro Lima","2019","http://link.springer.com/article/10.1007/s13218-019-00619-9","Article"
"On reversible Turing machines and their function universality","Acta Informatica","","53","5","10.1007/s00236-015-0253-y","Holger Bock AxelsenRobert Glück","2016","http://link.springer.com/article/10.1007/s00236-015-0253-y","Article"
"A Machine Learning Framework for Feature Selection in Heart Disease Classification Using Improved Particle Swarm Optimization with Support Vector Machine Classifier","Programming and Computer Software","","44","6","10.1134/S0361768818060129","J. VijayashreeH. Parveen Sultana","2018","http://link.springer.com/article/10.1134/S0361768818060129","Article"
"Cloud Database Management System security challenges and solutions: an analysis","CSI Transactions on ICT","","4","2 - 4","10.1007/s40012-016-0125-9","Shweta MalhotraMohammad Najmud DojaBashir AlamMansaf Alam","2016","http://link.springer.com/article/10.1007/s40012-016-0125-9","Article"
"Explainability in human–agent systems","Autonomous Agents and Multi-Agent Systems","","33","6","10.1007/s10458-019-09408-y","Avi RosenfeldAriella Richardson","2019","http://link.springer.com/article/10.1007/s10458-019-09408-y","Article"
"Environment-driven reachability for timed systems","International Journal on Software Tools for Technology Transfer","","19","2","10.1007/s10009-015-0401-2","Ciprian TeodorovPhilippe DhaussyLuka Le Roux","2017","http://link.springer.com/article/10.1007/s10009-015-0401-2","Article"
"Mosaic: A Scalable Coherence Protocol","International Journal of Parallel Programming","","46","6","10.1007/s10766-018-0557-y","Lucia G. MenezoValentin PuentePablo AbadJose-Angel Gregorio","2018","http://link.springer.com/article/10.1007/s10766-018-0557-y","Article"
"Human–agent collaboration for disaster response","Autonomous Agents and Multi-Agent Systems","","30","1","10.1007/s10458-015-9286-4","Sarvapali D. RamchurnFeng WuWenchao JiangJoel E. FischerSteve ReeceStephen RobertsTom RoddenChris GreenhalghNicholas R. Jennings","2016","http://link.springer.com/article/10.1007/s10458-015-9286-4","Article"
"Heterogeneous transfer learning techniques for machine learning","Iran Journal of Computer Science","","1","1","10.1007/s42044-017-0004-z","Muhammad Shahid IqbalBin LuoTamoor KhanRashid MehmoodMuhammad Sadiq","2018","http://link.springer.com/article/10.1007/s42044-017-0004-z","Article"
"Calculating Parallel Programs in Coq Using List Homomorphisms","International Journal of Parallel Programming","","45","2","10.1007/s10766-016-0415-8","Frédéric LoulergueWadoud BousdiraJulien Tesson","2017","http://link.springer.com/article/10.1007/s10766-016-0415-8","Article"
"A covariance matrix adaptation evolution strategy in reproducing kernel Hilbert space","Genetic Programming and Evolvable Machines","","20","4","10.1007/s10710-019-09357-1","Viet-Hung DangNgo Anh VienTaeChoong Chung","2019","http://link.springer.com/article/10.1007/s10710-019-09357-1","Article"
"Efficiently detecting switches against non-stationary opponents","Autonomous Agents and Multi-Agent Systems","","31","4","10.1007/s10458-016-9352-6","Pablo Hernandez-LealYusen ZhanMatthew E. TaylorL. Enrique SucarEnrique Munoz de Cote","2017","http://link.springer.com/article/10.1007/s10458-016-9352-6","Article"
"ASP for Conformance Analysis and Explanation of Clinical Guidelines Execution","KI - Künstliche Intelligenz","","32","2 - 3","10.1007/s13218-018-0540-1","Luca PiovesanMatteo SpiottaPaolo TerenzianiDaniele Theseider Dupré","2018","http://link.springer.com/article/10.1007/s13218-018-0540-1","Article"
"An extremely randomized trees method for weapons classification based on wound patterns of sharp metals using ultrasound images","Iran Journal of Computer Science","","2","4","10.1007/s42044-019-00036-z","Dayanand G. SavakarAnil Kannur","2019","http://link.springer.com/article/10.1007/s42044-019-00036-z","Article"
"A novel video scene change detection using successive estimation of statistical measure and HiBiSLI method","International Journal of Information Technology","","11","1","10.1007/s41870-018-0146-8","Dolley ShuklaManisha Sharma","2019","http://link.springer.com/article/10.1007/s41870-018-0146-8","Article"
"Unveiling evolutionary algorithm representation with DU maps","Genetic Programming and Evolvable Machines","","19","3","10.1007/s10710-018-9332-5","Eric MedvetMarco VirgolinMauro CastelliPeter A. N. BosmanIvo GonçalvesTea Tušar","2018","http://link.springer.com/article/10.1007/s10710-018-9332-5","Article"
"An approach for safer navigation under severe hurricane damage","Journal of Reliable Intelligent Environments","","4","3","10.1007/s40860-018-0066-1","Mohammad EshghiHedda R. Schmidtke","2018","http://link.springer.com/article/10.1007/s40860-018-0066-1","Article"
"A scalable Cloud-based system for data-intensive spatial analysis","International Journal on Software Tools for Technology Transfer","","18","6","10.1007/s10009-015-0398-6","R. O. SinnottW. Voorsluys","2016","http://link.springer.com/article/10.1007/s10009-015-0398-6","Article"
"From Research to Market: Building the Perception Systems for the Next Generation of Industrial Robots","KI - Künstliche Intelligenz","","33","2","10.1007/s13218-019-00583-4","Georg BartelsMichael Beetz","2019","http://link.springer.com/article/10.1007/s13218-019-00583-4","Article"
"Modeling culture in intelligent virtual agents","Autonomous Agents and Multi-Agent Systems","","30","5","10.1007/s10458-015-9312-6","Samuel MascarenhasNick DegensAna PaivaRui PradaGert Jan HofstedeAdrie BeulensRuth Aylett","2016","http://link.springer.com/article/10.1007/s10458-015-9312-6","Article"
"A hybrid auto-scaling technique for clouds processing applications with service level agreements","Journal of Cloud Computing","","6","1","10.1186/s13677-017-0100-5","Anshuman BiswasShikharesh MajumdarBiswajit NandyAli El-Haraki","2017","http://link.springer.com/article/10.1186/s13677-017-0100-5","Article"
"Industrial Applications of Answer Set Programming","KI - Künstliche Intelligenz","","32","2 - 3","10.1007/s13218-018-0548-6","Andreas FalknerGerhard FriedrichKonstantin SchekotihinRichard TaupeErich C. Teppan","2018","http://link.springer.com/article/10.1007/s13218-018-0548-6","Article"
"Improving generalization ability of instance transfer-based imbalanced sentiment classification of turn-level interactive Chinese texts","Service Oriented Computing and Applications","","13","2","10.1007/s11761-019-00264-y","Feng TianFan WuXiang FeiNazaraf ShahQinghua ZhengYuanyuan Wang","2019","http://link.springer.com/article/10.1007/s11761-019-00264-y","Article"
"Reasoning about product-line evolution using complex feature model differences","Automated Software Engineering","","23","4","10.1007/s10515-015-0185-3","Johannes BürdekTimo KehrerMalte LochauDennis ReulingUdo KelterAndy Schürr","2016","http://link.springer.com/article/10.1007/s10515-015-0185-3","Article"
"Adaptation in cloud resource configuration: a survey","Journal of Cloud Computing","","5","1","10.1186/s13677-016-0057-9","Abdul R. HummaidaNorman W. PatonRizos Sakellariou","2016","http://link.springer.com/article/10.1186/s13677-016-0057-9","Article"
"Hybrid location-centric e-Commerce recommendation model using dynamic behavioral traits of customer","Iran Journal of Computer Science","","2","3","10.1007/s42044-019-00040-3","B. R. SreenivasaC. R. Nirmala","2019","http://link.springer.com/article/10.1007/s42044-019-00040-3","Article"
"Studying the needed effort for identifying duplicate issues","Empirical Software Engineering","","21","5","10.1007/s10664-015-9404-6","Mohamed Sami RakhaWeiyi ShangAhmed E. Hassan","2016","http://link.springer.com/article/10.1007/s10664-015-9404-6","Article"
"Towards Explainable Process Predictions for Industry 4.0 in the DFKI-Smart-Lego-Factory","KI - Künstliche Intelligenz","","33","2","10.1007/s13218-019-00586-1","Jana-Rebecca RehseNijat MehdiyevPeter Fettke","2019","http://link.springer.com/article/10.1007/s13218-019-00586-1","Article"
"The Design and Implementation of TIDeFlow: A Dataflow-Inspired Execution Model for Parallel Loops and Task Pipelining","International Journal of Parallel Programming","","44","2","10.1007/s10766-015-0373-6","Daniel OrozcoElkin GarciaRobert PavelJaime ArteagaGuang Gao","2016","http://link.springer.com/article/10.1007/s10766-015-0373-6","Article"
"DDoS prevention using third party auditor in cloud computing","Iran Journal of Computer Science","","2","4","10.1007/s42044-019-00039-w","Rajat SaxenaSomnath Dey","2019","http://link.springer.com/article/10.1007/s42044-019-00039-w","Article"
"An Intents-based approach for dynamic service discovery","Service Oriented Computing and Applications","","10","1","10.1007/s11761-014-0163-9","Cheng ZhengWeiming ShenHamada H. Ghenniwa","2016","http://link.springer.com/article/10.1007/s11761-014-0163-9","Article"
"Self-adaptive concurrent components","Automated Software Engineering","","25","1","10.1007/s10515-017-0219-0","Erik ÖsterlundWelf Löwe","2018","http://link.springer.com/article/10.1007/s10515-017-0219-0","Article"
"A risk assessment model for selecting cloud service providers","Journal of Cloud Computing","","5","1","10.1186/s13677-016-0064-x","Erdal CayirciAlexandr GaragaAnderson Santana de OliveiraYves Roudier","2016","http://link.springer.com/article/10.1186/s13677-016-0064-x","Article"
"On Representation of Simulation Time in Functional Programming Style","Programming and Computer Software","","45","8","10.1134/S0361768819080073","D. V. BuzdalovA. K. PetrenkoA. V. Khoroshilov","2019","http://link.springer.com/article/10.1134/S0361768819080073","Article"
"Asynchronous approach in the plane: a deterministic polynomial algorithm","Distributed Computing","","32","4","10.1007/s00446-018-0338-2","Sébastien BouchardMarjorie BournatYoann DieudonnéSwan DuboisFranck Petit","2019","http://link.springer.com/article/10.1007/s00446-018-0338-2","Article"
"Virtualization vulnerabilities, security issues, and solutions: a critical study and comparison","International Journal of Information Technology","","","","10.1007/s41870-019-00294-x","Darshan TankAkshai AggarwalNirbhay Chaubey","2019","http://link.springer.com/article/10.1007/s41870-019-00294-x","Article"
"Checking interval properties of computations","Acta Informatica","","53","6 - 8","10.1007/s00236-015-0250-1","Alberto MolinariAngelo MontanariAniello MuranoGiuseppe PerelliAdriano Peron","2016","http://link.springer.com/article/10.1007/s00236-015-0250-1","Article"
"Toward Self-monitoring Smart Cities: the OpenSense2 Approach","Informatik-Spektrum","","40","1","10.1007/s00287-016-1009-y","Jean-Paul CalbimonteJulien EberleKarl Aberer","2017","http://link.springer.com/article/10.1007/s00287-016-1009-y","Article"
"Practical Performance Evaluation of Space Optimal Erasure Codes for High-Speed Data Storage Systems","SN Computer Science","","1","1","10.1007/s42979-019-0057-1","Rui ChenLihao Xu","2019","http://link.springer.com/article/10.1007/s42979-019-0057-1","Article"
"Editorial","International Journal of Information Technology","","10","1","10.1007/s41870-017-0070-3","M. N. Hoda","2018","http://link.springer.com/article/10.1007/s41870-017-0070-3","Article"
"Development of Web Service for Japanese Text Triplification","New Generation Computing","","34","4","10.1007/s00354-016-0401-0","Takahiro KawamuraAkihiko Ohsuga","2016","http://link.springer.com/article/10.1007/s00354-016-0401-0","Article"
"What spreadsheets are to numbers, process mining is to events","Informatik Spektrum","","42","5","10.1007/s00287-019-01198-7","Matthias Weidlich","2019","http://link.springer.com/article/10.1007/s00287-019-01198-7","Article"
"MeshCleaner: A Generic and Straightforward Algorithm for Cleaning Finite Element Meshes","International Journal of Parallel Programming","","46","3","10.1007/s10766-017-0507-0","Gang MeiSalvatore CuomoHong TianNengxiong XuLinjun Peng","2018","http://link.springer.com/article/10.1007/s10766-017-0507-0","Article"
"Least-change bidirectional model transformation with QVT-R and ATL","Software & Systems Modeling","","15","3","10.1007/s10270-014-0437-x","Nuno MacedoAlcino Cunha","2016","http://link.springer.com/article/10.1007/s10270-014-0437-x","Article"
"An exploration strategy for non-stationary opponents","Autonomous Agents and Multi-Agent Systems","","31","5","10.1007/s10458-016-9347-3","Pablo Hernandez-LealYusen ZhanMatthew E. TaylorL. Enrique SucarEnrique Munoz de Cote","2017","http://link.springer.com/article/10.1007/s10458-016-9347-3","Article"
"Analyzing and automatically labelling the types of user issues that are raised in mobile app reviews","Empirical Software Engineering","","21","3","10.1007/s10664-015-9375-7","Stuart McIlroyNasir AliHammad KhalidAhmed E. Hassan","2016","http://link.springer.com/article/10.1007/s10664-015-9375-7","Article"
"Symbolic checking of Fuzzy CTL on Fuzzy Program Graph","Acta Informatica","","56","1","10.1007/s00236-018-0311-3","Masoud EbrahimiGholamreza SotudehAli Movaghar","2019","http://link.springer.com/article/10.1007/s00236-018-0311-3","Article"
"Analyzing the power consumption behavior of a large scale data center","SICS Software-Intensive Cyber-Physical Systems","","34","1","10.1007/s00450-018-0394-7","Kashif Nizam KhanSanja ScepanovicTapio NiemiJukka K. NurminenSebastian Von AlfthanOlli-Pekka Lehto","2019","http://link.springer.com/article/10.1007/s00450-018-0394-7","Article"
"Multi-objective dynamic management of virtual machines in cloud environments","Journal of Cloud Computing","","6","1","10.1186/s13677-017-0086-z","Mahdi MollamotalebiShahnaz Hajireza","2017","http://link.springer.com/article/10.1186/s13677-017-0086-z","Article"
"Building accountability into the Internet of Things: the IoT Databox model","Journal of Reliable Intelligent Environments","","4","1","10.1007/s40860-018-0054-5","Andy CrabtreeTom LodgeJames ColleyChris GreenhalghKevin GloverHamed HaddadiYousef AmarRichard MortierQi LiJohn MooreLiang WangPoonam YadavJianxin ZhaoAnthony BrownLachlan UrquhartDerek McAuley","2018","http://link.springer.com/article/10.1007/s40860-018-0054-5","Article"
"Intelligent probabilistic broadcasting in mobile ad hoc network: a PSO approach","Journal of Reliable Intelligent Environments","","2","2","10.1007/s40860-016-0023-9","Sumit KumarShabana Mehfuz","2016","http://link.springer.com/article/10.1007/s40860-016-0023-9","Article"
"A semantic framework for ecommerce search engine optimization","International Journal of Information Technology","","11","1","10.1007/s41870-018-0232-y","Sunny SharmaSunita MahajanVijay Rana","2019","http://link.springer.com/article/10.1007/s41870-018-0232-y","Article"
"Parity game reductions","Acta Informatica","","55","5","10.1007/s00236-017-0301-x","Sjoerd CranenJeroen J. A. KeirenTim A. C. Willemse","2018","http://link.springer.com/article/10.1007/s00236-017-0301-x","Article"
"Can functional characteristics usefully define the cloud computing landscape and is the current reference model correct?","Journal of Cloud Computing","","6","1","10.1186/s13677-017-0084-1","Neil CaithnessMichel DrescherDavid Wallom","2017","http://link.springer.com/article/10.1186/s13677-017-0084-1","Article"
"Towards prioritizing user-related issue reports of mobile applications","Empirical Software Engineering","","24","4","10.1007/s10664-019-09684-y","Ehsan NoeiFeng ZhangShaohua WangYing Zou","2019","http://link.springer.com/article/10.1007/s10664-019-09684-y","Article"
"A multi-agent-based framework for cloud service discovery and selection using ontology","Service Oriented Computing and Applications","","12","2","10.1007/s11761-017-0224-y","Manoranjan ParhiBinod Kumar PattanayakManas Ranjan Patra","2018","http://link.springer.com/article/10.1007/s11761-017-0224-y","Article"
