Item Title,Publication Title,Book Series Title,Journal Volume,Journal Issue,Item DOI,Authors,Publication Year,URL,Content Type
"Simple and optimal randomized fault-tolerant rumor spreading","Distributed Computing","","29","2","10.1007/s00446-014-0238-z","Benjamin DoerrCarola DoerrShay MoranShlomo Moran","2016","http://link.springer.com/article/10.1007/s00446-014-0238-z","Article"
"Finding fault with fault injection: an empirical exploration of distortion in fault injection experiments","Software Quality Journal","","24","1","10.1007/s11219-014-9261-3","Erik van der KouweCristiano GiuffridaAndrew S. Tanenbaum","2016","http://link.springer.com/article/10.1007/s11219-014-9261-3","Article"
"Recoverable mutual exclusion","Distributed Computing","","32","6","10.1007/s00446-019-00364-0","Wojciech GolabAditya Ramaraju","2019","http://link.springer.com/article/10.1007/s00446-019-00364-0","Article"
"The impact of rapid release cycles on the integration delay of fixed issues","Empirical Software Engineering","","23","2","10.1007/s10664-017-9548-7","Daniel Alencar da CostaShane McIntoshChristoph TreudeUirá KuleszaAhmed E. Hassan","2018","http://link.springer.com/article/10.1007/s10664-017-9548-7","Article"
"A unifying framework for homogeneous model composition","Software & Systems Modeling","","18","5","10.1007/s10270-018-00707-8","Jörg KienzleGunter MussbacherBenoit CombemaleJulien Deantoni","2019","http://link.springer.com/article/10.1007/s10270-018-00707-8","Article"
"Addressing problems with replicability and validity of repository mining studies through a smart data platform","Empirical Software Engineering","","23","2","10.1007/s10664-017-9537-x","Fabian TrautschSteffen HerboldPhilip MakedonskiJens Grabowski","2018","http://link.springer.com/article/10.1007/s10664-017-9537-x","Article"
"Studying the difference between natural and programming language corpora","Empirical Software Engineering","","24","4","10.1007/s10664-018-9669-7","Casey CasalnuovoKenji SagaePrem Devanbu","2019","http://link.springer.com/article/10.1007/s10664-018-9669-7","Article"
"Algorithms for monitoring real-time properties","Acta Informatica","","55","4","10.1007/s00236-017-0295-4","David BasinFelix KlaedtkeEugen Zălinescu","2018","http://link.springer.com/article/10.1007/s00236-017-0295-4","Article"
"Are delayed issues harder to resolve? Revisiting cost-to-fix of defects throughout the lifecycle","Empirical Software Engineering","","22","4","10.1007/s10664-016-9469-x","Tim MenziesWilliam NicholsForrest ShullLucas Layman","2017","http://link.springer.com/article/10.1007/s10664-016-9469-x","Article"
"A toolset for conformance testing against UML sequence diagrams based on event-driven colored Petri nets","International Journal on Software Tools for Technology Transfer","","18","3","10.1007/s10009-014-0354-x","João Pascoal FariaAna C. R. Paiva","2016","http://link.springer.com/article/10.1007/s10009-014-0354-x","Article"
"Change-based test selection: an empirical evaluation","Empirical Software Engineering","","21","5","10.1007/s10664-015-9405-5","Quinten David SoetensSerge DemeyerAndy ZaidmanJavier Pérez","2016","http://link.springer.com/article/10.1007/s10664-015-9405-5","Article"
"Automatic performance prediction of multithreaded programs: a simulation approach","Automated Software Engineering","","25","1","10.1007/s10515-017-0214-5","Alexander TarvoSteven P. Reiss","2018","http://link.springer.com/article/10.1007/s10515-017-0214-5","Article"
"Encoding process discovery problems in SMT","Software & Systems Modeling","","17","4","10.1007/s10270-016-0536-y","Marc SoléJosep Carmona","2018","http://link.springer.com/article/10.1007/s10270-016-0536-y","Article"
"Towards automation of IT systems repairs","Software Quality Journal","","26","1","10.1007/s11219-016-9335-5","Janusz GórskiMarek Kamiński","2018","http://link.springer.com/article/10.1007/s11219-016-9335-5","Article"
"Using frame semantics for classifying and summarizing application store reviews","Empirical Software Engineering","","23","6","10.1007/s10664-018-9605-x","Nishant JhaAnas Mahmoud","2018","http://link.springer.com/article/10.1007/s10664-018-9605-x","Article"
"FOREPOST: finding performance problems automatically with feedback-directed learning software testing","Empirical Software Engineering","","22","1","10.1007/s10664-015-9413-5","Qi LuoAswathy NairMark GrechanikDenys Poshyvanyk","2017","http://link.springer.com/article/10.1007/s10664-015-9413-5","Article"
"Are tweets useful in the bug fixing process? An empirical study on Firefox and Chrome","Empirical Software Engineering","","23","3","10.1007/s10664-017-9559-4","Mariam El MezouarFeng ZhangYing Zou","2018","http://link.springer.com/article/10.1007/s10664-017-9559-4","Article"
"A context-aware recommendation-based system for service composition in smart environments","Service Oriented Computing and Applications","","13","4","10.1007/s11761-019-00277-7","Soufiane FaieqAgnès FrontRajaa SaidiHamid El GhaziMoulay Driss Rahmani","2019","http://link.springer.com/article/10.1007/s11761-019-00277-7","Article"
"Experimenting with information retrieval methods in the recovery of feature-code SPL traces","Empirical Software Engineering","","24","3","10.1007/s10664-018-9652-3","Tassio ValeEduardo Santana de Almeida","2019","http://link.springer.com/article/10.1007/s10664-018-9652-3","Article"
"Reusable specification templates for defining dynamic semantics of DSLs","Software & Systems Modeling","","18","1","10.1007/s10270-017-0590-0","Ulyana Tikhonova","2019","http://link.springer.com/article/10.1007/s10270-017-0590-0","Article"
"Reliable benchmarking: requirements and solutions","International Journal on Software Tools for Technology Transfer","","21","1","10.1007/s10009-017-0469-y","Dirk BeyerStefan LöwePhilipp Wendler","2019","http://link.springer.com/article/10.1007/s10009-017-0469-y","Article"
"Assessing and improving quality of QVTo model transformations","Software Quality Journal","","24","3","10.1007/s11219-015-9280-8","Christine M. GerpheideRamon R. H. SchiffelersAlexander Serebrenik","2016","http://link.springer.com/article/10.1007/s11219-015-9280-8","Article"
"Evolutionary trends of developer coordination: a network approach","Empirical Software Engineering","","22","4","10.1007/s10664-016-9478-9","Mitchell JoblinSven ApelWolfgang Mauerer","2017","http://link.springer.com/article/10.1007/s10664-016-9478-9","Article"
"Secure multi-party computation in large networks","Distributed Computing","","30","3","10.1007/s00446-016-0284-9","Varsha DaniValerie KingMahnush MovahediJared SaiaMahdi Zamani","2017","http://link.springer.com/article/10.1007/s00446-016-0284-9","Article"
"Unit testing performance with Stochastic Performance Logic","Automated Software Engineering","","24","1","10.1007/s10515-015-0188-0","Lubomír BulejTomáš BurešVojtěch HorkýJaroslav KotrčLukáš MarekTomáš TrojánekPetr Tůma","2017","http://link.springer.com/article/10.1007/s10515-015-0188-0","Article"
"Balancing the trade-off between accuracy and interpretability in software defect prediction","Empirical Software Engineering","","24","2","10.1007/s10664-018-9638-1","Toshiki MoriNaoshi Uchihira","2019","http://link.springer.com/article/10.1007/s10664-018-9638-1","Article"
"An efficient regression testing approach for PHP Web applications using test selection and reusable constraints","Software Quality Journal","","27","4","10.1007/s11219-019-09449-2","Ravi EdaHyunsook Do","2019","http://link.springer.com/article/10.1007/s11219-019-09449-2","Article"
"On the reaction to deprecation of clients of 4 + 1 popular Java APIs and the JDK","Empirical Software Engineering","","23","4","10.1007/s10664-017-9554-9","Anand Ashok SawantRomain RobbesAlberto Bacchelli","2018","http://link.springer.com/article/10.1007/s10664-017-9554-9","Article"
"Modern Problems of Software Integration in Computer Graphics Applications and Ways to Solve Them","Programming and Computer Software","","44","4","10.1134/S0361768818040060","V. A. FrolovV. V. Sanzharov","2018","http://link.springer.com/article/10.1134/S0361768818040060","Article"
"Predicting the delay of issues with due dates in software projects","Empirical Software Engineering","","22","3","10.1007/s10664-016-9496-7","Morakot ChoetkiertikulHoa Khanh DamTruyen TranAditya Ghose","2017","http://link.springer.com/article/10.1007/s10664-016-9496-7","Article"
"Review participation in modern code review","Empirical Software Engineering","","22","2","10.1007/s10664-016-9452-6","Patanamon ThongtanunamShane McIntoshAhmed E. HassanHajimu Iida","2017","http://link.springer.com/article/10.1007/s10664-016-9452-6","Article"
"Memory Partitioning in the Limit","International Journal of Parallel Programming","","44","2","10.1007/s10766-015-0380-7","Emre KültürsayKemal EbcioğluGürhan KüçükMahmut T. Kandemir","2016","http://link.springer.com/article/10.1007/s10766-015-0380-7","Article"
"Adapting MCP and HLFET Algorithms to Multiple Simultaneous Scheduling","International Journal of Parallel Programming","","46","3","10.1007/s10766-017-0516-z","Emilia PopaMauro IaconoFlorin Pop","2018","http://link.springer.com/article/10.1007/s10766-017-0516-z","Article"
"Assisting software engineering students in analyzing their performance in software development","Software Quality Journal","","27","3","10.1007/s11219-018-9433-7","Mushtaq RazaJoão Pascoal FariaRafael Salazar","2019","http://link.springer.com/article/10.1007/s11219-018-9433-7","Article"
"Enhance code search via reformulating queries with evolving contexts","Automated Software Engineering","","26","4","10.1007/s10515-019-00263-5","Qing HuangGuoqing Wu","2019","http://link.springer.com/article/10.1007/s10515-019-00263-5","Article"
"Tackling the term-mismatch problem in automated trace retrieval","Empirical Software Engineering","","22","3","10.1007/s10664-016-9479-8","Jin GuoMarek GibiecJane Cleland-Huang","2017","http://link.springer.com/article/10.1007/s10664-016-9479-8","Article"
"Result processing approaches for large smart grid co-simulations","Computer Science - Research and Development","","33","1 - 2","10.1007/s00450-017-0359-2","Frank MartenAnna-Lena MandAndreas BernardBjörn Kolja MielschMike Vogt","2018","http://link.springer.com/article/10.1007/s00450-017-0359-2","Article"
"Domain-specific machine translation with recurrent neural network for software localization","Empirical Software Engineering","","24","6","10.1007/s10664-019-09702-z","Xu WangChunyang ChenZhenchang Xing","2019","http://link.springer.com/article/10.1007/s10664-019-09702-z","Article"
"RETRACTED ARTICLE: The smell of fear: on the relation between test smells and flaky tests","Empirical Software Engineering","","24","5","10.1007/s10664-019-09683-z","Fabio PalombaAndy Zaidman","2019","http://link.springer.com/article/10.1007/s10664-019-09683-z","Article"
"Characterizing and identifying reverted commits","Empirical Software Engineering","","24","4","10.1007/s10664-019-09688-8","Meng YanXin XiaDavid LoAhmed E. HassanShanping Li","2019","http://link.springer.com/article/10.1007/s10664-019-09688-8","Article"
"Contention resolution on a fading channel","Distributed Computing","","32","6","10.1007/s00446-018-0323-9","Jeremy T. FinemanSeth GilbertFabian KuhnCalvin Newport","2019","http://link.springer.com/article/10.1007/s00446-018-0323-9","Article"
"A Neuro-fuzzy approach for user behaviour classification and prediction","Journal of Cloud Computing","","8","1","10.1186/s13677-019-0144-9","Atta-ur-RahmanSujata DashAshish Kr. LuhachNaveen ChilamkurtiSeungmin BaekYunyoung Nam","2019","http://link.springer.com/article/10.1186/s13677-019-0144-9","Article"
"The ANTS problem","Distributed Computing","","30","3","10.1007/s00446-016-0285-8","Ofer FeinermanAmos Korman","2017","http://link.springer.com/article/10.1007/s00446-016-0285-8","Article"
"The effects of visualization and interaction techniques on feature model configuration","Empirical Software Engineering","","21","4","10.1007/s10664-014-9353-5","Mohsen AsadiSamaneh SoltaniDragan GaševićMarek Hatala","2016","http://link.springer.com/article/10.1007/s10664-014-9353-5","Article"
"Time versus cost tradeoffs for deterministic rendezvous in networks","Distributed Computing","","29","1","10.1007/s00446-015-0253-8","Avery MillerAndrzej Pelc","2016","http://link.springer.com/article/10.1007/s00446-015-0253-8","Article"
"Rule-based specification mining leveraging learning to rank","Automated Software Engineering","","25","3","10.1007/s10515-018-0231-z","Zherui CaoYuan TianTien-Duy B. LeDavid Lo","2018","http://link.springer.com/article/10.1007/s10515-018-0231-z","Article"
"An Instrumentation Approach for Hardware-Agnostic Software Characterization","International Journal of Parallel Programming","","44","5","10.1007/s10766-016-0410-0","Andreea AnghelLaura Mihaela VasilescuGiovanni MarianiRik JongeriusGero Dittmann","2016","http://link.springer.com/article/10.1007/s10766-016-0410-0","Article"
"Using UML/MARTE to support performance tuning and stress testing in real-time systems","Software & Systems Modeling","","17","2","10.1007/s10270-017-0585-x","Stefano Di AlesioSagar Sen","2018","http://link.springer.com/article/10.1007/s10270-017-0585-x","Article"
"Feedback from nature: simple randomised distributed algorithms for maximal independent set selection and greedy colouring","Distributed Computing","","29","5","10.1007/s00446-016-0269-8","Peter JeavonsAlex ScottLei Xu","2016","http://link.springer.com/article/10.1007/s00446-016-0269-8","Article"
"Evaluating the impact of design pattern and anti-pattern dependencies on changes and faults","Empirical Software Engineering","","21","3","10.1007/s10664-015-9361-0","Fehmi JaafarYann-Gaël GuéhéneucSylvie HamelFoutse KhomhMohammad Zulkernine","2016","http://link.springer.com/article/10.1007/s10664-015-9361-0","Article"
"How effective are existing Java API specifications for finding bugs during runtime verification?","Automated Software Engineering","","26","4","10.1007/s10515-019-00267-1","Owolabi LegunsenNader Al AwarXinyue XuWajih Ul HassanGrigore RoşuDarko Marinov","2019","http://link.springer.com/article/10.1007/s10515-019-00267-1","Article"
"Model execution tracing: a systematic mapping study","Software and Systems Modeling","","18","6","10.1007/s10270-019-00724-1","Fazilat HojajiTanja MayerhoferBahman ZamaniAbdelwahab Hamou-LhadjErwan Bousse","2019","http://link.springer.com/article/10.1007/s10270-019-00724-1","Article"
"A comparison of tree- and line-oriented observational slicing","Empirical Software Engineering","","24","5","10.1007/s10664-018-9675-9","David BinkleyNicolas GoldSyed IslamJens KrinkeShin Yoo","2019","http://link.springer.com/article/10.1007/s10664-018-9675-9","Article"
"Web platforms for scientific research","Programming and Computer Software","","42","3","10.1134/S036176881603004X","A. P. KryukovA. P. DemichevS. P. Polyakov","2016","http://link.springer.com/article/10.1134/S036176881603004X","Article"
"Revisiting supervised and unsupervised models for effort-aware just-in-time defect prediction","Empirical Software Engineering","","24","5","10.1007/s10664-018-9661-2","Qiao HuangXin XiaDavid Lo","2019","http://link.springer.com/article/10.1007/s10664-018-9661-2","Article"
"Green Information Extraction from Family Books","SN Computer Science","","1","1","10.1007/s42979-019-0024-x","George Nagy","2019","http://link.springer.com/article/10.1007/s42979-019-0024-x","Article"
"The modular and feature toggle architectures of Google Chrome","Empirical Software Engineering","","24","2","10.1007/s10664-018-9639-0","Md Tajmilur RahmanPeter C. RigbyEmad Shihab","2019","http://link.springer.com/article/10.1007/s10664-018-9639-0","Article"
"A correct-by-construction model for asynchronously communicating systems","International Journal on Software Tools for Technology Transfer","","19","4","10.1007/s10009-016-0421-6","Zoubeyr FarahYamine Ait-AmeurMeriem OuederniKamel Tari","2017","http://link.springer.com/article/10.1007/s10009-016-0421-6","Article"
"Fostering good coding practices through individual feedback and gamification: an industrial case study","Empirical Software Engineering","","24","6","10.1007/s10664-019-09719-4","Matthieu FoucaultXavier BlancJean-Rémy FalleriMargaret-Anne Storey","2019","http://link.springer.com/article/10.1007/s10664-019-09719-4","Article"
"Optimal deployment of components of cloud-hosted application for guaranteeing multitenancy isolation","Journal of Cloud Computing","","8","1","10.1186/s13677-018-0124-5","Laud Charles OcheiAndrei PetrovskiJulian M. Bass","2019","http://link.springer.com/article/10.1186/s13677-018-0124-5","Article"
"Certifying delta-oriented programs","Software & Systems Modeling","","18","5","10.1007/s10270-018-00704-x","Vítor RodriguesSimone DonettiFerruccio Damiani","2019","http://link.springer.com/article/10.1007/s10270-018-00704-x","Article"
"Programmers do not favor lambda expressions for concurrent object-oriented code","Empirical Software Engineering","","24","1","10.1007/s10664-018-9622-9","Sebastian NielebockRobert HeumüllerFrank Ortmeier","2019","http://link.springer.com/article/10.1007/s10664-018-9622-9","Article"
"Making asynchronous distributed computations robust to noise","Distributed Computing","","32","5","10.1007/s00446-018-0343-5","Keren Censor-HillelRan GellesBernhard Haeupler","2019","http://link.springer.com/article/10.1007/s00446-018-0343-5","Article"
"An Analysis of Software Bug Reports Using Machine Learning Techniques","SN Computer Science","","1","1","10.1007/s42979-019-0004-1","Ha Manh TranSon Thanh LeSinh Van NguyenPhong Thanh Ho","2019","http://link.springer.com/article/10.1007/s42979-019-0004-1","Article"
"Scalable and precise estimation and debugging of the worst-case execution time for analysis-friendly processors: a comeback of model checking","International Journal on Software Tools for Technology Transfer","","21","5","10.1007/s10009-018-0497-2","Martin BeckerRavindra MettaR. VenkateshSamarjit Chakraborty","2019","http://link.springer.com/article/10.1007/s10009-018-0497-2","Article"
"A genetic algorithm based framework for software effort prediction","Journal of Software Engineering Research and Development","","5","1","10.1186/s40411-017-0037-x","Juan Murillo-MoreraChristian Quesada-LópezCarlos Castro-HerreraMarcelo Jenkins","2017","http://link.springer.com/article/10.1186/s40411-017-0037-x","Article"
"Analyzing execution traces: critical-path analysis and distance analysis","International Journal on Software Tools for Technology Transfer","","19","4","10.1007/s10009-016-0436-z","Martijn HendriksJacques VerrietTwan BastenBart TheelenMarco BrasséLou Somers","2017","http://link.springer.com/article/10.1007/s10009-016-0436-z","Article"
"An approach to clone detection in sequence diagrams and its application to security analysis","Software & Systems Modeling","","17","4","10.1007/s10270-016-0557-6","Manar H. AlalfiElizabeth P. AntonyJames R. Cordy","2018","http://link.springer.com/article/10.1007/s10270-016-0557-6","Article"
"Fresh apps: an empirical study of frequently-updated mobile apps in the Google play store","Empirical Software Engineering","","21","3","10.1007/s10664-015-9388-2","Stuart McIlroyNasir AliAhmed E. Hassan","2016","http://link.springer.com/article/10.1007/s10664-015-9388-2","Article"
"A Repair of Workflow Models Based on Mirroring Matrices","International Journal of Parallel Programming","","45","4","10.1007/s10766-016-0438-1","Yanan SunYuyue DuMaozhen Li","2017","http://link.springer.com/article/10.1007/s10766-016-0438-1","Article"
"Improving Record Linkage Accuracy with Hierarchical Feature Level Information and Parsed Data","New Generation Computing","","35","1","10.1007/s00354-016-0008-5","Yun ZhouMinlue WangValeriia HaberlandJohn HowroydSebastian DanicicJ. Mark Bishop","2017","http://link.springer.com/article/10.1007/s00354-016-0008-5","Article"
"Automatically learning usage behavior and generating event sequences for black-box testing of reactive systems","Software Quality Journal","","27","2","10.1007/s11219-018-9439-1","M. Furkan KıraçBarış AktemurHasan SözerCeren Şahin Gebizli","2019","http://link.springer.com/article/10.1007/s11219-018-9439-1","Article"
"A reasoning-based approach to dynamic domain reduction in test data generation","International Journal on Software Tools for Technology Transfer","","21","3","10.1007/s10009-018-0493-6","Esmaeel NikravanSaeed Parsa","2019","http://link.springer.com/article/10.1007/s10009-018-0493-6","Article"
"Ordered and delayed adversaries and how to work against them on a shared channel","Distributed Computing","","32","5","10.1007/s00446-018-0341-7","Marek KlonowskiDariusz R. KowalskiJarosław Mirek","2019","http://link.springer.com/article/10.1007/s00446-018-0341-7","Article"
"Breathe before speaking: efficient information dissemination despite noisy, limited and anonymous communication","Distributed Computing","","30","5","10.1007/s00446-015-0249-4","Ofer FeinermanBernhard HaeuplerAmos Korman","2017","http://link.springer.com/article/10.1007/s00446-015-0249-4","Article"
"Test them all, is it worth it? Assessing configuration sampling on the JHipster Web development stack","Empirical Software Engineering","","24","2","10.1007/s10664-018-9635-4","Axel HalinAlexandre NuttinckMathieu AcherXavier DevroeyGilles PerrouinBenoit Baudry","2019","http://link.springer.com/article/10.1007/s10664-018-9635-4","Article"
"A process mining-based analysis of business process work-arounds","Software & Systems Modeling","","15","2","10.1007/s10270-014-0420-6","Nesi OutmazginPnina Soffer","2016","http://link.springer.com/article/10.1007/s10270-014-0420-6","Article"
"Declarative Web services composition using proofs","Service Oriented Computing and Applications","","12","3 - 4","10.1007/s11761-018-0234-4","Sana BaccarMohsen RouachedRuben VerborghMohamed Abid","2018","http://link.springer.com/article/10.1007/s11761-018-0234-4","Article"
"An empirical study of software release notes","Empirical Software Engineering","","21","3","10.1007/s10664-015-9377-5","Surafel Lemma AbebeNasir AliAhmed E. Hassan","2016","http://link.springer.com/article/10.1007/s10664-015-9377-5","Article"
"Knowledge-based security testing of web applications by logic programming","International Journal on Software Tools for Technology Transfer","","21","2","10.1007/s10009-017-0472-3","Philipp ZechMichael FeldererRuth Breu","2019","http://link.springer.com/article/10.1007/s10009-017-0472-3","Article"
"Querying distilled code changes to extract executable transformations","Empirical Software Engineering","","24","1","10.1007/s10664-018-9644-3","Reinout StevensTim MolderezCoen De Roover","2019","http://link.springer.com/article/10.1007/s10664-018-9644-3","Article"
"Improving the pull requests review process using learning-to-rank algorithms","Empirical Software Engineering","","24","4","10.1007/s10664-019-09696-8","Guoliang ZhaoDaniel Alencar da CostaYing Zou","2019","http://link.springer.com/article/10.1007/s10664-019-09696-8","Article"
"Assessing the quality of industrial avionics software: an extensive empirical evaluation","Empirical Software Engineering","","22","4","10.1007/s10664-016-9440-x","Ji WuShaukat AliTao YueJie TianChao Liu","2017","http://link.springer.com/article/10.1007/s10664-016-9440-x","Article"
"A4WSN: an architecture-driven modelling platform for analysing and developing WSNs","Software & Systems Modeling","","18","4","10.1007/s10270-018-0687-0","Ivano MalavoltaLeonardo MostardaHenry MucciniEnver EverKrishna DoddapaneniOrhan Gemikonakli","2019","http://link.springer.com/article/10.1007/s10270-018-0687-0","Article"
"BPMN-E2: a BPMN extension for an enhanced workflow description","Software & Systems Modeling","","18","4","10.1007/s10270-018-0669-2","Mateo Ramos-MerinoJuan M. Santos-GagoLuis M. Álvarez-SabucedoVictor M. Alonso-RorisJavier Sanz-Valero","2019","http://link.springer.com/article/10.1007/s10270-018-0669-2","Article"
"Identifying the implied: Findings from three differentiated replications on the use of security requirements templates","Empirical Software Engineering","","22","4","10.1007/s10664-016-9481-1","Maria RiazJason KingJohn SlankasLaurie WilliamsFabio MassacciChristian Quesada-LópezMarcelo Jenkins","2017","http://link.springer.com/article/10.1007/s10664-016-9481-1","Article"
"Usability improvement through A/B testing and refactoring","Software Quality Journal","","27","1","10.1007/s11219-018-9413-y","Sergio FirmenichAlejandra GarridoJulián GrigeraJosé Matías RiveroGustavo Rossi","2019","http://link.springer.com/article/10.1007/s11219-018-9413-y","Article"
"Empirical study of android repackaged applications","Empirical Software Engineering","","24","6","10.1007/s10664-019-09760-3","Kobra KhanmohammadiNeda EbrahimiAbdelwahab Hamou-LhadjRaphaël Khoury","2019","http://link.springer.com/article/10.1007/s10664-019-09760-3","Article"
"Construing the big data based on taxonomy, analytics and approaches","Iran Journal of Computer Science","","1","4","10.1007/s42044-018-0024-3","Ajeet Ram PathakManjusha PandeySiddharth Rautaray","2018","http://link.springer.com/article/10.1007/s42044-018-0024-3","Article"
"What’s Spain’s Paris? Mining analogical libraries from Q&A discussions","Empirical Software Engineering","","24","3","10.1007/s10664-018-9657-y","Chunyang ChenZhenchang XingYang Liu","2019","http://link.springer.com/article/10.1007/s10664-018-9657-y","Article"
"Developing and evolving a DSL-based approach for runtime monitoring of systems of systems","Automated Software Engineering","","25","4","10.1007/s10515-018-0241-x","Rick RabiserJürgen Thanhofer-PilischMichael VierhauserPaul GrünbacherAlexander Egyed","2018","http://link.springer.com/article/10.1007/s10515-018-0241-x","Article"
